{
    "$schema": "habitat.schema.json",
    "kinds": [ "land", "water", "fishing" ],
    "by_season": [],
    "land": "tall_grass",
    "species": [
        {
            "species": "SPECIES_CORPHISH",
            "present": {
                "land": [],
                "water": [ "spring", "summer", "autumn", "winter" ],
                "fishing": []
            }
        },
        {
            "species": "SPECIES_BASCULIN",
            "present": {
                "land": [],
                "water": [ "spring", "summer", "autumn", "winter" ],
                "fishing": [ "spring", "summer", "autumn", "winter" ]
            },
            "forms": {
                "black2": {},
                "white2": {
                    "water": [ 1, 1, 1, 1 ],
                    "fishing": [ 1, 1, 1, 1 ]
                }
            }
        },
        {
            "species": "SPECIES_YANMA",
            "present": {
                "land": [ "spring", "summer", "autumn", "winter" ],
                "water": [],
                "fishing": []
            }
        },
        {
            "species": "SPECIES_ZEBSTRIKA",
            "present": {
                "land": [ "spring", "summer", "autumn", "winter" ],
                "water": [],
                "fishing": []
            }
        },
        {
            "species": "SPECIES_CRAWDAUNT",
            "present": {
                "land": [],
                "water": [ "spring", "summer", "autumn", "winter" ],
                "fishing": []
            }
        },
        {
            "species": "SPECIES_HERDIER",
            "present": {
                "land": [ "spring", "summer", "autumn", "winter" ],
                "water": [],
                "fishing": []
            }
        },
        {
            "species": "SPECIES_YANMEGA",
            "present": {
                "land": [ "spring", "summer", "autumn", "winter" ],
                "water": [],
                "fishing": []
            }
        },
        {
            "species": "SPECIES_STOUTLAND",
            "present": {
                "land": [ "spring", "summer", "autumn", "winter" ],
                "water": [],
                "fishing": []
            }
        },
        {
            "species": "SPECIES_GOLDEEN",
            "present": {
                "land": [],
                "water": [],
                "fishing": [ "spring", "summer", "autumn", "winter" ]
            }
        },
        {
            "species": "SPECIES_AUDINO",
            "present": {
                "land": [ "spring", "summer", "autumn", "winter" ],
                "water": [],
                "fishing": []
            }
        },
        {
            "species": "SPECIES_PURRLOIN",
            "present": {
                "land": [ "spring", "summer", "autumn", "winter" ],
                "water": [],
                "fishing": []
            }
        },
        {
            "species": "SPECIES_TRANQUILL",
            "present": {
                "land": [ "spring", "summer", "autumn", "winter" ],
                "water": [],
                "fishing": []
            }
        },
        {
            "species": "SPECIES_SEAKING",
            "present": {
                "land": [],
                "water": [],
                "fishing": [ "spring", "summer", "autumn", "winter" ]
            }
        },
        {
            "species": "SPECIES_UNFEZANT",
            "present": {
                "land": [ "spring", "summer", "autumn", "winter" ],
                "water": [],
                "fishing": []
            }
        },
        {
            "species": "SPECIES_WATCHOG",
            "present": {
                "land": [ "spring", "summer", "autumn", "winter" ],
                "water": [],
                "fishing": []
            }
        }
    ]
}
